{
  "schema_version": 1,
  "outcome_id": "outcome-spine-v1-002",
  "task_id": "task-spine-v1-002",
  "accepted": "accepted",
  "quality_score_milli": 920,
  "signals": {
    "build": "passed",
    "tests": "passed",
    "lint": "passed",
    "typecheck": "passed",
    "completion": "passed",
    "pr": "not_run",
    "correction": "passed",
    "rollback": "not_run",
    "retry": "not_run"
  },
  "contract_ref": "contract:accepted-outcome-v1",
  "evidence_refs": [
    {
      "kind": "QualityMeasurement",
      "uri": "urn:task-spine-v1:outcome:002",
      "digest": "sha256:task-spine-v1-002-outcome",
      "signature_status": "Verified"
    }
  ],
  "observed_at": "2026-08-01T11:05:00Z"
}
